{
  "schema": "contraste.models/v1",
  "case_id": "C03",
  "fit_id": "fixture-sba-7a",
  "model": [
    {
      "id": "P1-woe-scorecard",
      "family": "credit-scoring",
      "rung": "woe-scorecard",
      "title": {
        "en": "Fixture model P1-woe-scorecard",
        "es": "Modelo de ejemplo P1-woe-scorecard"
      },
      "short_title": {
        "en": "P1-woe-scorecard",
        "es": "P1-woe-scorecard"
      },
      "engine": "riskvalidation",
      "engine_version": "fixture",
      "licence": "MIT",
      "calibration": null,
      "parameters": {},
      "checkpoint_sha256": null,
      "details": {}
    }
  ],
  "fit": {
    "currency": "USD",
    "vintage_definition": {
      "basis": "approval fiscal year",
      "fiscal_year_start": "10-01",
      "label": {
        "en": "SBA fiscal year, 1 October to 30 September",
        "es": "Ano fiscal SBA, 1 de octubre a 30 de septiembre"
      }
    },
    "target": {
      "name": "charged-off-within-60-months",
      "horizon_months": 60,
      "observed_at_months": 60,
      "censoring": "exempt-right-censored",
      "definition": {
        "en": "A loan counts as an event when it is charged off within 60 months of approval; the target of a vintage is read only at its 5-year mark. EXEMPT (active) loans are right-censored.",
        "es": "Un credito es evento si se castiga dentro de 60 meses desde la aprobacion; el objetivo de una cosecha se lee solo en su marca de 5 anos. Los creditos EXEMPT (vigentes) son censurados por la derecha."
      }
    },
    "training": {
      "first_fy": 1991,
      "last_fy": 2012,
      "cutoff_date": "2017-09-30",
      "n_loans": 600000,
      "n_events": 54000,
      "crisis_included": true,
      "rationale": {
        "en": "Fixture: trained on vintages whose 5-year mark closed before the cutoff, so the crisis defaults are in the training outcomes.",
        "es": "Ejemplo: entrenado con cosechas cuya marca de 5 anos cerro antes del corte, de modo que los incumplimientos de la crisis estan en los resultados de entrenamiento."
      }
    },
    "cohort_windows": [
      {
        "id": "fy2006-07",
        "label": {
          "en": "FY2006-07",
          "es": "AF2006-07"
        },
        "first_fy": 2006,
        "last_fy": 2007
      },
      {
        "id": "fy2008-10",
        "label": {
          "en": "FY2008-10",
          "es": "AF2008-10"
        },
        "first_fy": 2008,
        "last_fy": 2010
      },
      {
        "id": "fy2011-14",
        "label": {
          "en": "FY2011-14",
          "es": "AF2011-14"
        },
        "first_fy": 2011,
        "last_fy": 2014
      },
      {
        "id": "fy2015-17",
        "label": {
          "en": "FY2015-17",
          "es": "AF2015-17"
        },
        "first_fy": 2015,
        "last_fy": 2017
      },
      {
        "id": "fy2018-20",
        "label": {
          "en": "FY2018-20",
          "es": "AF2018-20"
        },
        "first_fy": 2018,
        "last_fy": 2020
      }
    ],
    "ladder": [
      {
        "rung_id": "P1-woe-scorecard",
        "kind": "woe-scorecard",
        "covariates": [
          "term_months",
          "naics_sector"
        ],
        "coefficients": [
          {
            "name": "term_months",
            "estimate": -0.2,
            "std_error": 0.02
          },
          {
            "name": "intercept",
            "estimate": -2.1,
            "std_error": null
          }
        ],
        "training_cutoff": "2017-09-30",
        "engine": "riskvalidation"
      },
      {
        "rung_id": "P4-monotone-gbm",
        "kind": "monotone-gbm",
        "covariates": [
          "term_months",
          "naics_sector"
        ],
        "coefficients": [],
        "training_cutoff": "2017-09-30",
        "engine": "riskvalidation"
      }
    ],
    "data_status": {
      "primary_source": "sba-7a",
      "files_as_of": "2024-06-30",
      "fiscal_year_start": "10-01",
      "notice": {
        "en": "Fixture, not a result. The as-of date is a fixture value so that two vintages show an unobserved 5-year mark.",
        "es": "Ejemplo, no es un resultado. La fecha de corte es un valor de ejemplo para que dos cosechas muestren una marca de 5 anos no observada."
      }
    }
  },
  "provenance": {
    "truth_status": "real-outcomes",
    "inputs": [
      {
        "source": "fixture-not-a-result",
        "class": "fixture",
        "files": []
      }
    ],
    "licence_classes": {
      "fixture-not-a-result": "fixture"
    },
    "generators": [
      "fixture:u6-s-contracts"
    ],
    "seed": 0,
    "code_version": "fixture",
    "riskvalidation_version": null
  },
  "lane": {
    "lane": "precompute",
    "reasons": [
      "fixture"
    ]
  }
}
