{"schema":"contraste.models/v1","case_id":"C05","fit_id":"sp2009","model":[{"id":"M0-observed-2009","family":"rating-system","rung":"observed","title":{"en":"2009 grade default rates","es":"Tasas de incumplimiento por grado, 2009"},"short_title":{"en":"Observed 2009","es":"Observada 2009"},"engine":"none","engine_version":"none","licence":"MIT","checkpoint_sha256":null,"calibration":null,"parameters":{"pd":{"value":0.0399317406,"unit":"probability"},"accuracy_ratio":{"value":0.827102342,"unit":"unitless"}},"details":{"default_rate":[0.0,0.0,0.0,0.0,0.0029411764705882353,0.00392156862745098,0.0,0.004016064257028112,0.0018484288354898336,0.010893246187363835,0.0,0.010169491525423728,0.009070294784580499,0.0547945205479452,0.0995850622406639,0.1716171617161716,0.4842105263157895],"profile":[0.013822525597269625,0.006313993174061433,0.032081911262798635,0.041808873720136516,0.05802047781569966,0.08703071672354949,0.0931740614334471,0.08498293515358361,0.09232081911262799,0.07832764505119454,0.04539249146757679,0.050341296928327645,0.07525597269624573,0.07474402730375426,0.08225255972696245,0.051706484641638226,0.032423208191126277]}},{"id":"M1-qmm-2009","family":"rating-system","rung":"smoothed","title":{"en":"2009 PD curve smoothed by quasi moment matching","es":"Curva de PD 2009 suavizada por cuasi ajuste de momentos"},"short_title":{"en":"QMM 2009","es":"QMM 2009"},"engine":"riskvalidation.engines.pd_curve","engine_version":"1.1.0","licence":"MIT","checkpoint_sha256":null,"calibration":null,"parameters":{"alpha":{"value":5.20480998,"unit":"unitless"},"beta":{"value":2.16126859,"unit":"unitless"},"pd_target":{"value":0.0399317406,"unit":"probability"},"ar_target":{"value":0.827102342,"unit":"unitless"}},"details":{"curve":[2.7705617921264276e-05,5.8157852357647874e-05,0.00011760456279537445,0.00024886458190258396,0.00047150742500447673,0.0009127724925788389,0.001731931802893804,0.0029865767549192893,0.004946936466860397,0.007974957816757094,0.011379130703846928,0.01518558237761347,0.022800282920904386,0.039429265039662015,0.07999176640499751,0.1955688688577293,0.48353689830694047],"scores":[2.4471912877645834,2.1040797664520485,1.7782404038603994,1.4313550818729825,1.1355803342181017,0.8297444991920769,0.5330084537069667,0.2803105643732936,0.04590710994401283,-0.17645562035601192,-0.34252110644085487,-0.47782271088400285,-0.6694641670604856,-0.9308378771204832,-1.2781155864082487,-1.7538714199534333,-2.3777395299372035],"start":[5.0223587009841495,2.00485758557849],"default_profile":[0.0,0.0,0.0,0.0,0.004273504273504274,0.008547008547008548,0.0,0.008547008547008548,0.004273504273504274,0.021367521367521368,0.0,0.01282051282051282,0.017094017094017096,0.10256410256410256,0.20512820512820512,0.2222222222222222,0.39316239316239315],"survival_profile":[0.014397440455030218,0.006576608602915038,0.03341628154994668,0.043547813722004974,0.06025595449697831,0.0902950586562389,0.09704941343761109,0.08816210451475294,0.09598293636686811,0.08069676501955209,0.0472804834696054,0.05190188410949165,0.07767507998578031,0.07358691788126555,0.07714184145040881,0.04461429079274796,0.01741912548880199],"profile":[0.013822525597269625,0.006313993174061433,0.032081911262798635,0.041808873720136516,0.05802047781569966,0.08703071672354949,0.0931740614334471,0.08498293515358361,0.09232081911262799,0.07832764505119454,0.04539249146757679,0.050341296928327645,0.07525597269624573,0.07474402730375426,0.08225255972696245,0.051706484641638226,0.032423208191126277]}}],"fit":{"estimation_year":2009,"targets":{"pd":0.0399317406,"accuracy_ratio":0.827102342}},"provenance":{"truth_status":"published-answer","inputs":[{"source":"tasche-2013","class":"derived-only","files":[{"name":"tasche-2013-arxiv-1212.3716v6.pdf","sha256":"9a2c2116169617c41f1328069c7b941022606dab20acb39ef4e7d401fdcafdee"}]}],"licence_classes":{"tasche-2013":"derived-only"},"generators":[],"seed":42,"code_version":"1.00.000","riskvalidation_version":"1.1.0"},"lane":{"lane":"precompute","reasons":["not pure-python","wheels outside the live set: ['pypdf']","runtime exceeds the 1500ms budget"]}}