{"schema":"contraste.models/v1","case_id":"C10","fit_id":"c10","model":[{"id":"m-lhp","family":"portfolio-credit-capital","rung":"C1","title":{"en":"Large homogeneous portfolio (Vasicek)","es":"Cartera homogénea grande (Vasicek)"},"short_title":{"en":"LHP","es":"LHP"},"engine":"riskvalidation.portfolio.portfolio.lhp_measures","engine_version":"1.0.1","licence":"BSD-3-Clause","calibration":null,"parameters":{},"checkpoint_sha256":null,"details":{}},{"id":"m-gaussian-1f","family":"portfolio-credit-capital","rung":"C2","title":{"en":"Gaussian copula, one factor","es":"Cópula gaussiana, un factor"},"short_title":{"en":"Gaussian 1F","es":"Gaussiana 1F"},"engine":"riskvalidation.portfolio.copula.simulate_gaussian","engine_version":"1.0.1","licence":"BSD-3-Clause","calibration":null,"parameters":{},"checkpoint_sha256":null,"details":{}},{"id":"m-gaussian-mf","family":"portfolio-credit-capital","rung":"C2","title":{"en":"Gaussian copula, sector factors","es":"Cópula gaussiana, factores sectoriales"},"short_title":{"en":"Gaussian MF","es":"Gaussiana MF"},"engine":"riskvalidation.portfolio.copula.simulate_gaussian","engine_version":"1.0.1","licence":"BSD-3-Clause","calibration":null,"parameters":{},"checkpoint_sha256":null,"details":{}},{"id":"m-student-t","family":"portfolio-credit-capital","rung":"C3","title":{"en":"Student-t copula","es":"Cópula t de Student"},"short_title":{"en":"Student-t","es":"t de Student"},"engine":"riskvalidation.portfolio.copula.simulate_student_t","engine_version":"1.0.1","licence":"BSD-3-Clause","calibration":null,"parameters":{},"checkpoint_sha256":null,"details":{}},{"id":"m-creditrisk-plus","family":"portfolio-credit-capital","rung":"C4","title":{"en":"CreditRisk+ (stable recursion)","es":"CreditRisk+ (recursión estable)"},"short_title":{"en":"CreditRisk+","es":"CreditRisk+"},"engine":"riskvalidation.portfolio.creditrisk_plus.pmf_stable","engine_version":"1.0.1","licence":"BSD-3-Clause","calibration":null,"parameters":{},"checkpoint_sha256":null,"details":{}}],"fit":{"currency":"USD","windows":{"fit":{"first_year":1985,"last_year":2006,"n_years":22},"evaluation":{"first_year":2007,"last_year":2012,"n_years":6}},"loan_types":[{"id":"commercial-industrial","label":{"en":"Commercial and industrial","es":"Comerciales e industriales"},"table_column":"C&I loans (column CI)","irb_asset_class":"corporate","irb_reference":"CRE31.5"},{"id":"commercial-real-estate","label":{"en":"Commercial real estate","es":"Inmobiliario comercial"},"table_column":"Commercial (column RECI)","irb_asset_class":"hvcre","irb_reference":"CRE31.11"},{"id":"residential","label":{"en":"Residential real estate","es":"Crédito hipotecario residencial"},"table_column":"Residential (column RERES)","irb_asset_class":"residential_mortgage","irb_reference":"CRE31.14"},{"id":"credit-cards","label":{"en":"Credit cards","es":"Tarjetas de crédito"},"table_column":"Credit cards (column CONCC)","irb_asset_class":"qrre","irb_reference":"CRE31.15"},{"id":"other-consumer","label":{"en":"Other consumer","es":"Otro consumo"},"table_column":"Other (column CONOTH)","irb_asset_class":"other_retail","irb_reference":"CRE31.16"}],"estimators":[{"id":"maximum-likelihood","label":{"en":"Maximum likelihood","es":"Máxima verosimilitud"},"engine_function":"riskvalidation.portfolio.asrf_fit.fit_ml","interval_method":"profile-likelihood","reference":"Vasicek (2002); dossier 04 C.4"},{"id":"moments","label":{"en":"Method of moments","es":"Método de momentos"},"engine_function":"riskvalidation.portfolio.asrf_fit.fit_moments","interval_method":"parametric-bootstrap","reference":"dossier 04 C.4 (E[L^2] = joint default probability)"}],"ladder":[{"id":"c1-lhp","rung":"C1","method":"lhp-vasicek","label":{"en":"Large homogeneous portfolio (Vasicek)","es":"Cartera homogénea grande (Vasicek)"},"estimator":"analytic","n_scenarios":null,"evaluated":true,"engine_function":"riskvalidation.portfolio.portfolio.lhp_measures","reference":"Vasicek (2002), Risk, December 2002; dossier 04 C.4","parameters":[{"name":"pd","value":0.00910490011,"unit":"decimal"},{"name":"rho","value":0.0636765484,"unit":"-"}]},{"id":"c2-gaussian-1f","rung":"C2","method":"gaussian-copula-one-factor","label":{"en":"Gaussian copula, one factor","es":"Cópula gaussiana, un factor"},"estimator":"monte-carlo","n_scenarios":1000000,"evaluated":true,"engine_function":"riskvalidation.portfolio.copula.simulate_gaussian","reference":"Li (2000); dossier 04 H.3","parameters":[{"name":"lgd","value":0.45,"unit":"decimal"}]},{"id":"c2-gaussian-mf","rung":"C2","method":"gaussian-copula-multi-factor","label":{"en":"Gaussian copula, sector factors","es":"Cópula gaussiana, factores sectoriales"},"estimator":"monte-carlo","n_scenarios":1000000,"evaluated":true,"engine_function":"riskvalidation.portfolio.copula.simulate_gaussian","reference":"Li (2000); dossier 04 H.3","parameters":[{"name":"n_factors","value":2.0,"unit":"-"},{"name":"factor_correlation","value":0.5,"unit":"-"}]},{"id":"c3-student-t","rung":"C3","method":"student-t-copula","label":{"en":"Student-t copula","es":"Cópula t de Student"},"estimator":"monte-carlo","n_scenarios":1000000,"evaluated":true,"engine_function":"riskvalidation.portfolio.copula.simulate_student_t","reference":"Frey and McNeil (2003); Demarta and McNeil (2005); dossier 04 H.3","parameters":[{"name":"nu","value":5.0,"unit":"-"}]},{"id":"c4-creditrisk-plus","rung":"C4","method":"creditrisk-plus","label":{"en":"CreditRisk+ (stable recursion)","es":"CreditRisk+ (recursión estable)"},"estimator":"analytic","n_scenarios":null,"evaluated":true,"engine_function":"riskvalidation.portfolio.creditrisk_plus.pmf_stable","reference":"Haaf, Reiss and Schoenmakers (2004); dossier 04 H.4","parameters":[{"name":"loss_unit","value":1000.0,"unit":"USD"}]},{"id":"c5-granularity","rung":"C5","method":"granularity-adjustment","label":{"en":"Granularity adjustment","es":"Ajuste por granularidad"},"estimator":"analytic","n_scenarios":null,"evaluated":true,"engine_function":"riskvalidation.portfolio.granularity.granularity_adjustment","reference":"Gordy and Lutkebohmert (2013); dossier 04 H.5","parameters":[{"name":"xi","value":0.25,"unit":"-"},{"name":"gamma","value":0.25,"unit":"-"}]},{"id":"c6-is-gaussian","rung":"C6","method":"importance-sampling","label":{"en":"Importance sampling, Gaussian copula","es":"Muestreo por importancia, cópula gaussiana"},"estimator":"monte-carlo","n_scenarios":100000,"evaluated":true,"engine_function":"riskvalidation.portfolio.importance.importance_sample_gaussian","reference":"Glasserman and Li (2005); dossier 04 H.7 (the twist is UNVERIFIED there; acceptance is unbiasedness against plain Monte Carlo)","parameters":[]},{"id":"c6-is-student-t","rung":"C6","method":"importance-sampling","label":{"en":"Importance sampling, Student-t copula","es":"Muestreo por importancia, cópula t"},"estimator":"monte-carlo","n_scenarios":100000,"evaluated":false,"engine_function":"riskvalidation.portfolio.importance.importance_sample_gaussian","reference":"Glasserman and Li (2005); no Student-t twist is specified, so the rung is a not-evaluated row","parameters":[]}],"portfolio_spec":{"label":"illustrative","notice":{"en":"Illustrative portfolio: the groups shown are those of commercial and industrial; every loan type has its own groups in its document. Constructed for the case, never a bank's.","es":"Cartera ilustrativa: los grupos mostrados son los de comerciales e industriales; cada tipo de préstamo tiene sus propios grupos en su documento. Construida para el caso, nunca la de un banco."},"currency":"USD","groups":[{"id":"g-large","label":{"en":"Large names","es":"Nombres grandes"},"n_names":20,"ead_each":2000000.0,"pd":0.00505827784,"lgd":0.45,"loading":0.252342126,"sector":"core"},{"id":"g-mid","label":{"en":"Mid-size names","es":"Nombres medianos"},"n_names":100,"ead_each":400000.0,"pd":0.0101165557,"lgd":0.45,"loading":0.252342126,"sector":"core"},{"id":"g-small","label":{"en":"Small names","es":"Nombres pequeños"},"n_names":1000,"ead_each":20000.0,"pd":0.0151748335,"lgd":0.45,"loading":0.252342126,"sector":"periphery"}],"lgd_mean":0.45,"lgd_gamma":0.25,"levels":[0.99,0.999],"horizon_years":1},"granularity":{"xi":0.25,"gamma":0.25,"k_source":"irb-regulatory-correlation","xi_reference":0.25,"q_reference":0.999,"delta_reference":4.83,"reference":"Gordy and Lutkebohmert (2013), eq. 15 and eq. 16 (dossier 04 H.5)"},"simulator":{"known_pd":0.02,"rho_grid":[0.02,0.04,0.06,0.08,0.1,0.12,0.14,0.16,0.18,0.2,0.22,0.24],"series_lengths_years":[22,40],"n_replications":400,"null_rho":0.12,"alpha":0.05,"seed":7001}},"provenance":{"truth_status":"real-outcomes","inputs":[{"source":"fed-chargeoff","class":"mirror-allowed","files":[{"name":"chgallsa.htm","sha256":"eee388f9681023ccc130542af90966abef657217c1a151bfb0c51d9e8588fa11"}]},{"source":"illustrative-portfolio","class":"illustrative","files":[]}],"licence_classes":{"fed-chargeoff":"mirror-allowed","illustrative-portfolio":"illustrative"},"generators":["contraste.c10.illustrative-portfolio"],"seed":42,"code_version":"1.00.000","riskvalidation_version":"1.0.1"},"lane":{"lane":"precompute","reasons":["not pure-python","runtime exceeds the 1500ms budget"]}}